{
  "$schema": "https://developer.microsoft.com/json-schemas/fabric/item/report/definition/report/3.0.0/schema.json",
  "themeCollection": {
    "baseTheme": {
      "name": "CY24SU06",
      "reportVersionAtImport": {
        "visual": "1.8.92",
        "report": "2.0.92",
        "page": "1.3.92"
      },
      "type": "SharedResources"
    },
    "customTheme": {
      "name": "Custom8273953987843872.json",
      "reportVersionAtImport": {
        "visual": "1.8.93",
        "report": "2.0.93",
        "page": "1.3.93"
      },
      "type": "RegisteredResources"
    }
  },
  "filterConfig": {
    "filters": [
      {
        "name": "819f884e4e0916d7de90",
        "ordinal": 0,
        "field": {
          "Column": {
            "Expression": {
              "SourceRef": {
                "Entity": "Date"
              }
            },
            "Property": "Date"
          }
        },
        "type": "RelativeDate",
        "filter": {
          "Version": 2,
          "From": [
            {
              "Name": "d",
              "Entity": "Date",
              "Type": 0
            }
          ],
          "Where": [
            {
              "Condition": {
                "Comparison": {
                  "ComparisonKind": 0,
                  "Left": {
                    "Column": {
                      "Expression": {
                        "SourceRef": {
                          "Source": "d"
                        }
                      },
                      "Property": "Date"
                    }
                  },
                  "Right": {
                    "DateSpan": {
                      "Expression": {
                        "Now": {}
                      },
                      "TimeUnit": 3
                    }
                  }
                }
              }
            }
          ]
        },
        "howCreated": "User"
      },
      {
        "name": "98d872e30db7b1e2c065",
        "ordinal": 1,
        "field": {
          "Column": {
            "Expression": {
              "SourceRef": {
                "Entity": "Date"
              }
            },
            "Property": "Date"
          }
        },
        "type": "Advanced",
        "filter": {
          "Version": 2,
          "From": [
            {
              "Name": "d",
              "Entity": "Date",
              "Type": 0
            }
          ],
          "Where": [
            {
              "Condition": {
                "Comparison": {
                  "ComparisonKind": 2,
                  "Left": {
                    "Column": {
                      "Expression": {
                        "SourceRef": {
                          "Source": "d"
                        }
                      },
                      "Property": "Date"
                    }
                  },
                  "Right": {
                    "DateSpan": {
                      "Expression": {
                        "Literal": {
                          "Value": "datetime'2024-01-01T00:00:00'"
                        }
                      },
                      "TimeUnit": 5
                    }
                  }
                }
              }
            }
          ]
        },
        "howCreated": "User",
        "isHiddenInViewMode": true,
        "isLockedInViewMode": true
      },
      {
        "name": "da42ae80de672da6a0ce",
        "ordinal": 2,
        "field": {
          "Column": {
            "Expression": {
              "SourceRef": {
                "Entity": "Date"
              }
            },
            "Property": "Future Dates Hidden"
          }
        },
        "type": "Categorical",
        "filter": {
          "Version": 2,
          "From": [
            {
              "Name": "d",
              "Entity": "Date",
              "Type": 0
            }
          ],
          "Where": [
            {
              "Condition": {
                "In": {
                  "Expressions": [
                    {
                      "Column": {
                        "Expression": {
                          "SourceRef": {
                            "Source": "d"
                          }
                        },
                        "Property": "Future Dates Hidden"
                      }
                    }
                  ],
                  "Values": [
                    [
                      {
                        "Literal": {
                          "Value": "'True'"
                        }
                      }
                    ]
                  ]
                }
              }
            }
          ]
        },
        "howCreated": "User",
        "isHiddenInViewMode": true,
        "isLockedInViewMode": true
      },
      {
        "name": "118059265cfefacbd6b1",
        "ordinal": 3,
        "field": {
          "Column": {
            "Expression": {
              "SourceRef": {
                "Entity": "Product"
              }
            },
            "Property": "Item Division"
          }
        },
        "type": "Categorical",
        "howCreated": "User"
      },
      {
        "name": "1b1a99265a03748295e7",
        "ordinal": 4,
        "field": {
          "Column": {
            "Expression": {
              "SourceRef": {
                "Entity": "Product"
              }
            },
            "Property": "Item Department"
          }
        },
        "type": "Categorical",
        "howCreated": "User"
      },
      {
        "name": "1c0252f32d60a3b75f11",
        "ordinal": 5,
        "field": {
          "Column": {
            "Expression": {
              "SourceRef": {
                "Entity": "Product"
              }
            },
            "Property": "Item Main Category"
          }
        },
        "type": "Categorical",
        "howCreated": "User"
      }
    ],
    "filterSortOrder": "Custom"
  },
  "objects": {
    "section": [
      {
        "properties": {
          "verticalAlignment": {
            "expr": {
              "Literal": {
                "Value": "'Top'"
              }
            }
          }
        }
      }
    ],
    "outspacePane": [
      {
        "properties": {
          "expanded": {
            "expr": {
              "Literal": {
                "Value": "false"
              }
            }
          }
        }
      }
    ]
  },
  "publicCustomVisuals": [
    "PBI_CV_9272D058_BEA0_476A_B090_A712545F92FA"
  ],
  "resourcePackages": [
    {
      "name": "RegisteredResources",
      "type": "RegisteredResources",
      "items": [
        {
          "name": "Clear_all_slicers14676744101821415.png",
          "path": "Clear_all_slicers14676744101821415.png",
          "type": "Image"
        },
        {
          "name": "Custom8273953987843872.json",
          "path": "Custom8273953987843872.json",
          "type": "CustomTheme"
        },
        {
          "name": "Dark_Filter12239714763250309.png",
          "path": "Dark_Filter12239714763250309.png",
          "type": "Image"
        },
        {
          "name": "Revenue5709653548238078.png",
          "path": "Revenue5709653548238078.png",
          "type": "Image"
        },
        {
          "name": "Transaction25375699078957157.png",
          "path": "Transaction25375699078957157.png",
          "type": "Image"
        },
        {
          "name": "RSP7171207118047747.png",
          "path": "RSP7171207118047747.png",
          "type": "Image"
        },
        {
          "name": "BSV9643992797576042.png",
          "path": "BSV9643992797576042.png",
          "type": "Image"
        },
        {
          "name": "units2546279553007339.png",
          "path": "units2546279553007339.png",
          "type": "Image"
        },
        {
          "name": "Revenue7562269609032337.png",
          "path": "Revenue7562269609032337.png",
          "type": "Image"
        },
        {
          "name": "Transaction204563823809520828.png",
          "path": "Transaction204563823809520828.png",
          "type": "Image"
        },
        {
          "name": "logo_light5175679416783505.png",
          "path": "logo_light5175679416783505.png",
          "type": "Image"
        },
        {
          "name": "OFF_toggle5017825499638412.png",
          "path": "OFF_toggle5017825499638412.png",
          "type": "Image"
        },
        {
          "name": "ON_toggle35209159514765465.png",
          "path": "ON_toggle35209159514765465.png",
          "type": "Image"
        }
      ]
    },
    {
      "name": "SharedResources",
      "type": "SharedResources",
      "items": [
        {
          "name": "CY24SU06",
          "path": "BaseThemes/CY24SU06.json",
          "type": "BaseTheme"
        }
      ]
    }
  ],
  "settings": {
    "isPersistentUserStateDisabled": true,
    "useStylableVisualContainerHeader": true,
    "defaultFilterActionIsDataFilter": true,
    "defaultDrillFilterOtherVisuals": true,
    "allowChangeFilterTypes": true,
    "allowInlineExploration": true,
    "useEnhancedTooltips": true,
    "useDefaultAggregateDisplayName": true,
    "queryLimitOption": "None",
    "customMemoryLimit": "1048576",
    "customTimeoutLimit": "225"
  },
  "slowDataSourceSettings": {
    "isCrossHighlightingDisabled": false,
    "isSlicerSelectionsButtonEnabled": false,
    "isFilterSelectionsButtonEnabled": false,
    "isFieldWellButtonEnabled": false,
    "isApplyAllButtonEnabled": false
  }
}